{
  "topicId": "agentic-ai-beginner",
  "title": "Essential ingredients",
  "description": "Explore the components that let an AI agent perceive its environment, decide what to do, and learn from the outcome.",
  "ui": {
    "rootLabel": "Essential ingredients",
    "quickNotesLabel": "Quick Notes",
    "sectionsLabel": "Mind map topics",
    "mapLabel": "Agent mind map",
    "panHint": "Hold and drag to move the mind map. Use a card's arrow to expand or collapse its branches.",
    "expandLabel": "Expand child topics",
    "collapseLabel": "Collapse child topics",
    "expandDetailsLabel": "Expand details",
    "collapseDetailsLabel": "Collapse details",
    "loadingLabel": "Loading quick notes…",
    "unavailableTitle": "Quick Notes unavailable",
    "unavailableText": "There are no quick notes for this topic yet.",
    "backLabel": "Back to topics"
  },
  "root": {
    "id": "essential-ingredients",
    "title": "Essential ingredients",
    "cardType": "root",
    "summary": "How an agent senses, thinks, acts, and adapts.",
    "content": [
      { "type": "paragraph", "data": { "text": "An AI agent operates in a loop: it receives information, interprets the situation, chooses an action, changes its environment, and observes the result." } },
      { "type": "callout", "data": { "label": "The loop", "text": "Perceive → interpret → decide → act → observe" } }
    ],
    "children": [
      {
        "id": "environment",
        "title": "Environment",
        "cardType": "term",
        "summary": "The world the agent perceives and interacts with.",
        "content": [
          { "type": "paragraph", "data": { "text": "An environment may be physical, digital, or a combination. It contains the conditions, systems, and other actors that can affect the agent's goal." } },
          { "type": "bulletList", "data": { "items": ["Physical: roads, vehicles, people, signs, and weather", "Digital: stores, catalogs, prices, reviews, and user preferences", "Combined: digital information alongside location, season, or local conditions"] } }
        ],
        "children": [
          {
            "id": "environment-dynamic",
            "title": "Dynamic conditions",
            "cardType": "detail",
            "summary": "The world can change while the agent is working.",
            "content": [
              { "type": "paragraph", "data": { "text": "Agents often work in environments where relevant facts change over time. A plan based on an earlier observation can become stale before it is carried out." } },
              { "type": "orderedList", "data": { "items": ["Identify which conditions can change.", "Decide how often the agent needs fresh observations.", "Re-check important facts before consequential actions."] } },
              { "type": "callout", "data": { "label": "Example", "text": "A shopping assistant should check current stock and price before it recommends a product as available." } }
            ],
            "children": [
              {
                "id": "environment-boundaries",
                "title": "Define the boundary",
                "cardType": "term",
                "summary": "Specify which parts of the world are relevant to this task.",
                "content": [
                  { "type": "paragraph", "data": { "text": "A clear boundary identifies the systems, people, time horizon, and conditions that matter. It also helps exclude unrelated or sensitive information." } }
                ],
                "children": [
                  {
                    "id": "environment-scope-checklist",
                    "title": "Scope checklist",
                    "cardType": "detail",
                    "summary": "Make the operating context explicit before choosing sensors or tools.",
                    "content": [
                      { "type": "bulletList", "data": { "items": ["What entities and conditions can affect the goal?", "Which sources are authoritative and current?", "What information is unnecessary or sensitive?", "Which changes require the agent to reassess its plan?"] } }
                    ],
                    "children": [
                      {
                        "id": "environment-scope-test",
                        "title": "Test a missing-context case",
                        "cardType": "term",
                        "summary": "Define what the agent does when a required fact is unavailable.",
                        "content": [
                          { "type": "paragraph", "data": { "text": "A robust environment model identifies missing or stale context as a condition to handle. The agent can retrieve updated information, ask the user, or stop before taking an unsafe action." } }
                        ]
                      }
                    ]
                  }
                ]
              }
            ]
          },
          {
            "id": "environment-examples",
            "title": "Physical and digital examples",
            "cardType": "term",
            "summary": "Different tasks place the agent in different kinds of worlds.",
            "content": [
              { "type": "heading", "data": { "text": "Self-driving car" } },
              { "type": "paragraph", "data": { "text": "Road layout, traffic, pedestrians, weather, and traffic signs all form part of the car's environment." } },
              { "type": "heading", "data": { "text": "Shopping assistant" } },
              { "type": "paragraph", "data": { "text": "Product catalogs, user preferences, prices, reviews, promotions, weather, and season can all influence a recommendation." } }
            ]
          }
        ]
      },
      {
        "id": "sensors",
        "title": "Sensors",
        "cardType": "term",
        "summary": "The channels through which the agent gathers input.",
        "content": [
          { "type": "paragraph", "data": { "text": "Sensors are the means by which an agent receives information from its environment. They turn signals into observations the agent can process." } },
          { "type": "bulletList", "data": { "items": ["Web scrapers and search tools", "APIs and database connections", "Cameras, microphones, LiDAR, and GPS", "IoT devices and other live data integrations"] } }
        ],
        "children": [
          {
            "id": "sensor-physical",
            "title": "Physical sensors",
            "cardType": "detail",
            "summary": "Devices that measure the physical world.",
            "content": [
              { "type": "paragraph", "data": { "text": "Physical agents combine sensors because each captures different evidence and has different limitations." } },
              { "type": "bulletList", "data": { "items": ["Cameras capture visual scenes and signs.", "LiDAR estimates distance and surrounding geometry.", "GPS provides location signals.", "Microphones capture audio; vehicle systems provide additional state readings."] } },
              { "type": "callout", "data": { "label": "Design check", "text": "Consider sensor coverage, delay, calibration, obstruction, and what the agent should do when a signal is unreliable." } }
            ]
          },
          {
            "id": "sensor-digital",
            "title": "Digital inputs",
            "cardType": "term",
            "summary": "Software tools that retrieve information from online systems.",
            "content": [
              { "type": "paragraph", "data": { "text": "A shopping agent may use web scrapers for product information, APIs for browsing history, comparison modules for prices, and integrations for live weather." } }
            ],
            "children": [
              {
                "id": "sensor-quality",
                "title": "Input quality and freshness",
                "cardType": "detail",
                "summary": "Collected data can be incomplete, delayed, or contradictory.",
                "content": [
                  { "type": "paragraph", "data": { "text": "The model can only reason from the evidence it receives. Sources, timestamps, permissions, and validation all affect how much an observation should be trusted." } },
                  { "type": "bulletList", "data": { "items": ["Track where an observation came from.", "Check whether it is recent enough for the task.", "Detect missing or conflicting values.", "Ask for clarification or pause if critical inputs are uncertain."] } }
                ]
              }
            ]
          }
        ]
      },
      {
        "id": "model",
        "title": "Model",
        "cardType": "term",
        "summary": "The component that interprets observations and forms an understanding.",
        "content": [
          { "type": "paragraph", "data": { "text": "Collecting data is only the first step. A model processes perceptions, recognizes context, and helps the agent understand what may be happening." } },
          { "type": "bulletList", "data": { "items": ["Machine-learning algorithms for focused tasks", "Neural networks for complex patterns", "Large language models for language-based reasoning", "Multimodal models that combine text, images, audio, or video"] } }
        ],
        "children": [
          {
            "id": "model-types",
            "title": "Model capability",
            "cardType": "detail",
            "summary": "Choose a model that fits the information and task.",
            "content": [
              { "type": "paragraph", "data": { "text": "Models range in sophistication. A focused classifier may be enough for a narrow decision, while a multimodal language model can interpret several kinds of information together." } },
              { "type": "callout", "data": { "label": "Remember", "text": "A model's interpretation is evidence for a decision, not proof that an action is safe, authorized, or correct." } }
            ]
          },
          {
            "id": "model-multimodal",